{
  "blockers": [],
  "clarification": null,
  "evidence": [],
  "followUp": [],
  "groups": [],
  "questions": [],
  "summary": "### 独立评审报告（Feedback 阶段候选草案全面核验）\n\n作为独立评审者，已依据规划上下文要求完整遍历扫描全部 583 项索引记录（`requiredOnly=true`，无截断读取至 `nextOffset=null`），对最新候选草案（`workerResults.draft`）、变更基线（`changeReviewBaseline`）、用户反馈（`rawInputs/7` 及各阶段输入）、已确认决策（`approvedDecisions`）与证据链进行了逐项交叉比对与契约闭合审查。评审结论为**合格通过（Blockers: 0）**。\n\n---\n\n### 一、核心整改项逐项比对与验证结论\n\n1. **4大核心痛点与产品定位完整恢复**：\n   - `block-problem-fragmented-ideas` 完整恢复了“碎片信息无序堆积导致灵感沉没与查找困难”、“缺少轻量快速记录入口”、“缺少灵活低摩擦组织分类”与“缺乏可靠本地防丢备份”4大核心痛点，以及灵感回顾重温的核心价值。\n   - `block-non-goals-heavy-pkm` 明确将树形复杂目录、双链网状图谱与重量级 WYSIWYG 排版划为非目标，紧扣个人轻量 Web SPA 本地随手记定位。\n   - 全功能快捷键统一为 `Ctrl/Cmd + Enter`，彻底消除了此前与 `Ctrl+S` 的不一致；保留了 `AppMeta`（主题、字号、视图模式、排序）、`BackupTrackerMeta`、`requestPersistence` 与 `isPersisted`，并对 Markdown 代码块提供一键复制与完善验收标准。\n\n2. **IndexedDB CAS 乐观锁与防隐式复活闭环**：\n   - `saveNote(noteId, updates, expectedRevision, sessionGeneration)` 强制在 Dexie `readwrite` 单一事务中比对 `existing.revision === expectedRevision` 与代际一致性，遇冲突抛出明确的 `StaleRevisionError` / `SessionConflictError`。\n   - 独立区分 `createNote` 与 `saveNote`，创建生成全新 UUID 且 `revision=1`，杜绝 upsert 盲写导致的已物理删除便签隐式复活。\n   - 置顶（`isPinned`）、加星（`isStarred`）、归档（`status: 'archived'`）与软删除（`status: 'trashed'`）等全部状态流转均受 CAS 保护；软删除具备幂等性，重复触发不覆盖 `previousStatus` 且不重置保留倒计时。\n\n3. **单调递增库代际（libraryGeneration）机制**：\n   - 存储层维护全局单调递增的 `libraryGeneration`。全量覆盖导入成功后代际自增，旧标签页或旧编辑会话的 `sessionGeneration` 自动失效并拒绝脏写，彻底解决跨备份恢复后的数据覆盖隐患。\n\n4. **备份文件格式规范与独立草稿导出**：\n   - 明确标准 `BackupPayload`（`schemaVersion: 1`），包含 `meta`（`appMeta`, `backupTracker`）、`tags`、`notes`，具备完整类型与枚举防御性校验。\n   - 针对未保存草稿，提供独立的【导出当前未保存草稿】能力（`spark-draft-${noteId}-${timestamp}.json`），与全量备份文件命名与结构清晰区分，保障极端断电或配额满载下的资产自救。\n\n5. **sessionStorage 双重隔离与诚实生命周期界定**：\n   - 草稿暂存键名采用 `spark_draft_${libraryGeneration}_${noteId}`，同时实现代际与便签维度隔离。\n   - 草稿恢复仅载入前端编辑视图内存，受 CAS 锁约束，不旁路直写 IndexedDB；如实界定草稿生命周期绑定标签页顶层会话，刷新可恢复，标签页彻底关闭后随之终止，不作虚假绝对不丢承诺。\n\n6. **运行环境协议与离线边界清晰**：\n   - 明确应用基于 Vite 静态构建输出 `dist/`，运行于标准 Web 服务器或本地预览（`vite preview` / `http://localhost:4173`）提供的 HTTP/HTTPS 安全上下文，明确声明不支持 `file://` 协议运行。\n   - 严格区分“离线运行”（页面已加载状态下的全功能离线操作）与“离线冷启动”（依赖 PWA/Service Worker，已明确划为未来演进）。\n\n7. **性能指标口径统一与规划环境诚实性**：\n   - 冷启动耗时统一以 W3C 标准 `PerformanceNavigationTiming`（`startTime: 0`，`navigationStart`）为测量起点，至首屏快速录入框可见且可交互（TTI），目标主流浏览器 <= 1.0s。\n   - 检索时延明确包含：物理击键 -> 80ms 防抖等待 -> 内存分词匹配 -> `<mark>` 高亮渲染 -> DOM 可见的完整端到端耗时，1000 条种子数据 nearest-rank P95 <= 150ms。\n   - 因当前规划环境 Docker 守护进程不可用（unavailable），验证任务 `val-storage-and-search-benchmark` 诚实标注为 `unexecuted`，保留详细的 Playwright 测试脚本用例、失败修订路径（倒排索引、虚拟滚动）与交付前置补测指引，无虚假通过。\n\n8. **7天回收期具体行为与防误删防御**：\n   - 常量明确为 `RETENTION_MS = 604,800,000 ms`（严格 `>=` 7天判定），引入本地时钟回拨防御；\n   - 用户停留在回收区时跨越 7 天不暗中删除眼前卡片，通过常驻琥珀色横幅提示超期数量，一键清空与清空过期便签均受二次确认模态窗保护。\n\n9. **接口定义、任务依赖序与验收标准全链路闭环**：\n   - `IStorageService`、`IBackupService`、`ISessionDraftService`、`ISearchService` 契约完备；\n   - 构建部署任务 `task-build-and-deploy` 严格声明依赖全部 7 项业务实现任务；冗余验证块 `val-browser-storage-and-search-perf` 已正确加入 `removeBlockIds`，由单一集成任务 `val-storage-and-search-benchmark` 与验收块 `acceptance-storage-and-search-benchmark` 承接。\n   - 全部 43 项候选规范块在需求、流程、任务与验收间 ID 映射完整无断链。\n\n---\n\n### 二、评审结论\n当前候选草案（`workerResults.draft`）完全修复了上一轮反馈指出的所有缺陷，逻辑自洽、边界严密、接口完整、证据真实、求实诚信，无需追加用户决策或技术阻塞，同意作为最新待批准草案提交。\n\n- **实质阻塞（Blockers）**：无（`blockers: []`）。"
}
