{
  "blockers": [
    "计时器绝对精度承诺与实测保证不成立：blk-prod-outcomes、blk-feat-input-display、blk-acc-input-display、blk-tech-val-performance、blk-deliv-val-perf-benchmark 将“300ms 防抖等待”表述为绝对时间保证，断言在主流浏览器中必然在 300ms~350ms 内完成首帧重绘。依据 MDN Window: setTimeout()（evidence-7ec331d7-1d2e-415d-abc5-fecbed731559），浏览器定时器受主线程忙碌排队、非活动标签页限制（节流至 1s/1m）及 CPU 调度影响，无法保证绝对物理时延。需由整合任务将指标收敛为“设计衡量目标与排队触发阈值”，避免断言为已验证绝对事实。",
    "性能测量指标代理语义与真实绘制语义混淆：blk-prod-outcomes、blk-tech-val-performance、blk-deliv-val-perf-benchmark 将 domContentLoadedEventEnd 直接断言为“首屏冷启动渲染耗时”，并将 requestAnimationFrame 回调直接断言为“首帧重绘渲染结束”。依据 MDN DOMContentLoaded（evidence-3469a02f-5c3d-4632-ad1c-3d2799d0f76d）与 requestAnimationFrame（evidence-1e97c25e-7c1d-430e-a66a-f6f416297f34），DOMContentLoaded 仅表示文档解析及延迟脚本执行完毕（不等待绘制），rAF 回调发生在下一次重绘之前。需由整合任务将指标客观修正为“DOM 解析与就绪耗时”及“重绘前微任务处理耗时”，或依据 PerformancePaintTiming（evidence-4da3f92d-842d-4557-85da-38b670b16ba4）引入客观绘制指标。",
    "安全防护表述超出证据支持边界：dec-safe-text-rendering、blk-prod-outcomes、blk-tech-stack、blk-deliv-val-security-xss-audit 宣称使用 textContent 使得应用“从根本上杜绝 DOM 型 XSS”。依据 MDN Node.textContent（evidence-mdn-textcontent-xss-safety），textContent 仅能保障将内容作为单一纯文本节点挂载、不调用 HTML 解析器，杜绝该展示节点上的 HTML 注入，不能代表整个应用消除所有 DOM XSS 汇聚点。需由整合任务收敛为“确保项目名展示节点按纯文本渲染，杜绝该展示节点的 HTML 标签解析与脚本注入风险”。",
    "安全审计验证步骤的正则表达式语法不可执行：blk-deliv-val-security-xss-audit 步骤 1 中的正则匹配 eval\\\\\\\\\\\\\\\\( 经 tasks.json 导出并被 JSON 反序列化后，导致 JS 正则解析抛出 SyntaxError: Unterminated group。依据 feedback 原文（input:b30e9949-62a0-4fd8-b9eb-e553ede58563），需由整合任务替换为明确可复制执行的源码检查或测试程序（例如使用合法转义的字符串匹配或解析无误的正则），并保留 10 组动态恶意 Payload 回显测试。",
    "任务职责重复与交付依赖拓扑颠倒：blk-task-input-display、blk-task-reset、blk-tech-task-impl 与 delivery 阶段开发任务存在相同功能的冗余定义；同时 blk-deliv-task-package 仅依赖 blk-deliv-spec-deployment，未依赖具体的前端实现任务（blk-deliv-task-layout-styling、blk-deliv-task-input-workflow、blk-deliv-task-reset-workflow、blk-deliv-task-error-handling），导致执行拓扑颠倒。需由整合任务统一清理冗余任务，并修正开发与验证任务的拓扑闭包。",
    "ESM 模块化与 file:// 本地双击直接运行存在架构契约冲突：blk-tech-stack 规定“ESM 模块化架构”，而 blk-tech-deployment 与 blk-deliv-spec-deployment 承诺直接双击 index.html（file:// 协议）零服务运行。依据 MDN 模块规范（evidence-320443a6-461c-4976-9039-908598ac05f0）与 script defer 规范（evidence-6e9f4e98-9c5e-426e-998a-5dd25a59c3cb），file:// 下加载原生 ES Module 会触发浏览器 CORS 拦截，而经典脚本配合 defer 可在 file:// 下免服务器直接运行。需由整合任务统一采用经典脚本闭包模块化形态，消除技术栈与部署规范矛盾。",
    "官方证据 evidence-1e97c25e-7c1d-430e-a66a-f6f416297f34 缺少 research_read 获取记录；请真实查证或转为未验证任务。"
  ],
  "clarification": null,
  "evidence": [
    {
      "applicability": "适用于 300ms 防抖调度机制与交互响应时间契约。证实浏览器定时器受主线程排队、嵌套节流与后台标签页限制，不可作为绝对 300ms 触发的物理保证，应界定为排队阈值与待验证性能指标。",
      "content": "MDN 官方文档 Window: setTimeout() 指出：Late timeouts: The timeout can also fire later than expected if the page (or the OS/browser) is busy with other tasks... Currently-executing code must complete before functions on the queue are executed... 且浏览器对非活动标签页存在最低超时节流限制（如 Chrome/Firefox 节流至 1 秒或 1 分钟）。因此 300ms 防抖等待是触发阈值，无法作为所有浏览器绝对精确 300ms 到期执行的实测保证。",
      "hash": "e05d53596ebb56f13d18a0b46d631c3bdbec3d1a668c981198fb7ae8afdf05ab",
      "id": "evidence-7ec331d7-1d2e-415d-abc5-fecbed731559",
      "kind": "official-source",
      "location": "https://developer.mozilla.org/en-US/docs/Web/API/Window/setTimeout#reasons_for_longer_delays_than_specified",
      "obtainedAt": "2026-10-04T22:04:46.667Z",
      "outcome": "passed",
      "source": "https://developer.mozilla.org/en-US/docs/Web/API/Window/setTimeout"
    },
    {
      "applicability": "适用于首屏冷启动指标定义与验证。证实 DOMContentLoaded 仅表示 HTML 解析和延迟脚本执行完成，不代表首屏绘制（Paint）完成，指标命名应客观为 DOM 就绪耗时。",
      "content": "MDN 官方文档 Document: DOMContentLoaded event 指出：The DOMContentLoaded event fires when the HTML document has been completely parsed, and all deferred scripts have downloaded and executed. It doesn't wait for other things like images, subframes, and async scripts to finish loading. DOMContentLoaded does not wait for stylesheets to load. 该事件表明 DOM 结构解析与 deferred 脚本就绪，不证明屏幕像素已完成绘制。",
      "hash": "9b325565454622c9a10a1649160ec3a8714cd9465390ddc69c0805c3907429df",
      "id": "evidence-3469a02f-5c3d-4632-ad1c-3d2799d0f76d",
      "kind": "official-source",
      "location": "https://developer.mozilla.org/en-US/docs/Web/API/Document/DOMContentLoaded_event",
      "obtainedAt": "2026-10-04T22:04:41.826Z",
      "outcome": "passed",
      "source": "https://developer.mozilla.org/en-US/docs/Web/API/Document/DOMContentLoaded_event"
    },
    {
      "applicability": "适用于防抖实时展示测量终点定义。证实 requestAnimationFrame 回调发生于下一次重绘之前，不能直接代表屏幕重绘完成，应作为重绘前回调准备终点。",
      "content": "MDN 官方文档 Window: requestAnimationFrame() method 指出：The window.requestAnimationFrame() method tells the browser you wish to perform an animation. It requests the browser to call a user-supplied callback function before the next repaint. 该回调在浏览器执行下一次重绘之前被触发，用于更新动画或计算下一帧状态，不能直接作为屏幕重绘渲染已经完成的结束点。",
      "hash": "bc4a512deb613f05d113055298ceeaf8afe3ce63c471d1450229a1989b92bd48",
      "id": "evidence-1e97c25e-7c1d-430e-a66a-f6f416297f34",
      "kind": "official-source",
      "location": "https://developer.mozilla.org/en-US/docs/Web/API/window/requestAnimationFrame",
      "obtainedAt": "2026-10-04T22:05:24.234Z",
      "outcome": "passed",
      "source": "https://developer.mozilla.org/en-US/docs/Web/API/window/requestAnimationFrame"
    },
    {
      "applicability": "适用于浏览器首屏渲染与关键绘制时刻（FP/FCP）的客观测量，规范性能指标测量边界。",
      "content": "MDN 官方文档 PerformancePaintTiming 指出：The PerformancePaintTiming interface provides timing information about 'paint' (also called 'render') operations during web page construction. 'Paint' refers to conversion of the render tree to on-screen pixels. 提供 First Paint (FP) 与 First Contentful Paint (FCP) 指标。在浏览器性能实测中，必须严格区分 DOMContentLoaded（文档解析与延迟脚本执行完毕，即 DOM 就绪）与真正的 Paint 绘制完成。",
      "hash": "77c2b997624e6a581ca2bd1b9f035b79f17b46f9fbb235d0177519d8604ff597",
      "id": "evidence-4da3f92d-842d-4557-85da-38b670b16ba4",
      "kind": "official-source",
      "location": "https://developer.mozilla.org/en-US/docs/Web/API/PerformancePaintTiming",
      "obtainedAt": "2026-10-04T22:05:32.176Z",
      "outcome": "passed",
      "source": "https://developer.mozilla.org/en-US/docs/Web/API/PerformancePaintTiming"
    },
    {
      "applicability": "适用于单页面入口脚本加载与本地双击运行可行性依据。证实经典脚本加 defer 属性兼容 file:// 本地直接运行。",
      "content": "MDN 官方文档 <script> 指出：The defer Boolean attribute indicates that the script is meant to be executed after the document has been parsed, but before firing DOMContentLoaded event. The defer attribute has no effect on module scripts — they defer by default. 经典脚本配合 defer 能够实现不阻塞解析并在 DOM 就绪前执行，且不受 module 脚本在 file:// 协议下的跨域安全限制。",
      "hash": "de8f6b87e834f3158dd54ed7c693dc4eb052d5bf7d5dea7d8fadf037bc778e50",
      "id": "evidence-6e9f4e98-9c5e-426e-998a-5dd25a59c3cb",
      "kind": "official-source",
      "location": "https://developer.mozilla.org/en-US/docs/Web/HTML/Reference/Elements/script#defer",
      "obtainedAt": "2026-10-04T22:05:11.082Z",
      "outcome": "passed",
      "source": "https://developer.mozilla.org/en-US/docs/Web/HTML/Reference/Elements/script"
    },
    {
      "applicability": "记录当前规划环境受控试验由于 Docker 引擎不可用未执行，实际端到端性能与 XSS 验证编排为交付阶段由开发者在真实桌面浏览器环境中执行。",
      "content": "environment_prepare (node) failed to connect to docker API at npipe:////./pipe/dockerDesktopLinuxEngine; check if the path is correct and if the daemon is running. Container execution is unavailable. 规划工具的 Docker 限制属于当前规划环境，不是用户项目约束。",
      "environment": "node:24.13.0-bookworm-slim (Docker Desktop unavailable on host)",
      "id": "evidence-08b0b066-87e2-4046-b1ba-05ae29301050",
      "kind": "experiment",
      "location": "D:\\Temp\\User\\pa-real-integration-AiRDUO\\项目构思\\runtime\\planning\\run-e7a309b3-95fb-462f-82b1-222e72e31a5e\\tools\\experiments\\prepare-113c48f6-9eaa-48fa-b6db-7ed86da57210.ndjson",
      "obtainedAt": "2026-10-05T06:04:41+08:00",
      "outcome": "unexecuted",
      "source": "experiment:prepare-113c48f6-9eaa-48fa-b6db-7ed86da57210"
    }
  ],
  "followUp": [],
  "groups": [],
  "questions": [],
  "summary": "本任务针对自动化质量验收反馈（input:b30e9949-62a0-4fd8-b9eb-e553ede58563）开展独立官方规范查证与可行性证据梳理。新增发现与受影响契约包括：1. 依据 MDN Window: setTimeout() 规范，浏览器定时器存在宏任务排队延迟与非活动标签页节流，300ms 防抖等待为排队触发阈值而非绝对物理时延保证，影响 blk-prod-outcomes、blk-feat-input-display 等契约；2. 依据 MDN 规范，DOMContentLoaded 仅表示文档与 deferred 脚本解析执行就绪（不保证绘制完成），requestAnimationFrame 发生于重绘之前（不代表绘制完成），首屏与交互性能耗时应客观命名为 DOM 就绪耗时与重绘前微任务处理耗时，或通过 PerformancePaintTiming 规范定义；3. 依据 MDN Node.textContent 规范，textContent 仅保障该展示节点不被作为 HTML 解析，不能夸大为杜绝全应用 DOM XSS；4. blk-deliv-val-security-xss-audit 正则存在转义错误导致 SyntaxError，需替换为可解析执行的测试程序；5. 经典脚本配合 defer 支持在 file:// 下本地双击直接执行，解决与 ESM 模块化在 file:// 下产生 CORS 报错的冲突；6. 探测确认当前规划宿主机 Docker 不可用，受控试验记录为 unexecuted，属于规划工具环境限制，不影响纯静态项目交付。全部缺口已记录至 blockers 移交整合任务处理。"
}
