{
  "blockers": [
    "具体缺口 1（交付规范粒度校正与参考代码降级）：blk-tech-interface 的标题与正文将大段内部实现伪代码表述为“完整自包含/无ReferenceError风险/契约基准”，超出了规划期架构蓝图的权威界限，且内部 JavaScript 存在回滚判定与提交时机不一致的隐式缺陷。依据自动质量验收反馈 input:238e3436-8977-448a-8760-831f4163ca8c，须将该实现代码明确降级为“非执行示意，非CodingAgent直接复制的参考实现”，优先以模块接口签名、状态所有权、前置守卫与提交/回滚后置条件作为权威规范，同步正文及引用描述。受影响块 ID：blk-tech-interface。",
    "具体缺口 2（清空替换后回滚在 DOM 中遗留双输入框缺陷 R6-B1/P1）：在清空状态事务流转中，若 oldNode.replaceWith(newNode) 物理替换执行成功后，后续步骤（DisplayRenderer.renderPlaceholder、FeedbackBanner.clearInputError 或 newNode.focus()）发生异常触发回滚，原 rollback 逻辑依赖 activeInputNode !== oldNode 判定新节点是否挂载；由于 activeInputNode 仅在最后一步原子提交，此时 activeInputNode 仍为 oldNode，导致 rollback 判定失败走 insertBefore 分支仅回插原节点，未移除已挂载的新节点，在 DOM 树中遗留两个具有相同 ID（project-name-input）的输入框，破坏了“失败时原子回滚恢复且保持唯一输入框”的核心契约。必须在事务回滚规则与验收用例中明确清理或替换已挂载新节点，确保 DOM 树中有且仅有单一原节点。依据：input:238e3436-8977-448a-8760-831f4163ca8c 及 DOM 规范。受影响块 ID：blk-tech-interface, blk-tech-error, blk-feat-reset, blk-flow-reset, blk-page-main-layout, blk-acc-reset, blk-deliv-task-reset-workflow, blk-deliv-acc-full-e2e。"
  ],
  "clarification": null,
  "evidence": [
    {
      "applicability": "用户原始需求输入边界与约束",
      "content": "我想做一个给自己用的本地原型核对页面：上传截图仅作布局参考；文字说明负责行为，不自动把图里的示例文字变成业务需求。只做一个输入项目名、点击确认、展示项目名和清空的单页面。目标是快速核对输入反馈，失败时保留输入。浏览器运行，桌面优先；无需服务端、登录、协作或支付。核心验收：输入任意项目名后可确认显示，空值有提示；具体布局请完整查看截图并描述真实内容。其余普通细节明确委托 AI 拟定，设计建议仍待批准。",
      "environment": "local",
      "hash": "5feeb9ec9123fa64c0c12e448303eaafebb56333c01fe10738a5af505148d1f3",
      "id": "evidence-6f5d1676-8b42-4b82-a3ad-8bfbf7e3b827",
      "kind": "material",
      "location": "inputs/inp-01/source.txt",
      "obtainedAt": "2026-10-05T01:47:07.392Z",
      "outcome": "passed",
      "source": "material:input:inp-01"
    },
    {
      "applicability": "fixture.png 参考图视觉结构与空间映射",
      "content": "fixture.png 图像像素结构显示：纯白背景，顶部包含大字黑色文本“Q7M4-8261”；底部左侧为蓝色实心矩形色块（原确认按钮布局映射位置），底部右侧为橙色实心圆形色块（清空按钮布局映射位置）。仅作为单页面布局与视觉映射参考，示例文字不作为业务需求。",
      "environment": "local",
      "hash": "0e4b4b8fa59957ba9320f18df50383c59f4ad40978b0cba304d20c0f85bb14a0",
      "id": "evidence-503b30a4-9462-4618-ac0b-72d3e0f215e7",
      "kind": "material",
      "location": "inputs/inp-1791129999124/fixture.png",
      "obtainedAt": "2026-10-05T01:47:12.750Z",
      "outcome": "passed",
      "source": "material:input:inp-1791129999124"
    },
    {
      "applicability": "R6质量验收反馈关于代码粒度降级与清空替换后回滚遗留双输入框缺陷",
      "content": "自动质量验收反馈指出：1. 交付粒度校正：blk-tech-interface 的整段内部 JavaScript 产生与正文不一致的额外偏差，明确降为非执行示意，以接口参数、状态所有权及提交/回滚后置条件为权威；2. R6-B1/P1：替换后回滚在 renderPlaceholder/clearInputError/focus 抛错时，由于 activeInputNode 仍为 oldNode，导致 rollback 仅回插 oldNode 而未移除已挂载的 newNode，在 DOM 中遗留两个同 ID 输入框。回滚必须完整清理已挂载的新节点，恢复单一输入框拓扑。",
      "environment": "local",
      "hash": "892aa0fae6479fbb35acb3212a6971c6d50b72bfe14efdc653ad5d6872770b2b",
      "id": "evidence-fc126627-6e55-40e5-8be5-388ef378a21b",
      "kind": "user",
      "location": "rawInputs:238e3436-8977-448a-8760-831f4163ca8c",
      "obtainedAt": "2026-10-05T01:47:33.613Z",
      "outcome": "passed",
      "source": "input:238e3436-8977-448a-8760-831f4163ca8c"
    },
    {
      "applicability": "规划期受控试验环境可用性查证",
      "content": "在规划期环境中尝试运行 Node.js 运行时受控试验，由于 Docker Desktop Linux 引擎管道不可用，受控试验环境不可用，试验未执行。如实记录为 unexecuted，此限制属于当前规划期宿主工具环境限制，非用户项目约束，真实浏览器和原生运行验证留待开发阶段在真实宿主环境中执行。",
      "environment": "{\"runtime\":\"node\",\"image\":\"node:24.13.0-bookworm-slim\",\"network\":\"none\"}",
      "hash": "1f68294dc48999669419465d7a413f224a5dbe59e51bf93c418e2389d5ed8a56",
      "id": "evidence-90e45d59-73b5-4869-a91e-fc38e938452f",
      "kind": "experiment",
      "location": "tools/experiments/experiment-a8677773-5738-4751-8edc-8b549c27efcf",
      "obtainedAt": "2026-10-05T01:47:36.695Z",
      "outcome": "unexecuted",
      "source": "experiment:experiment-a8677773-5738-4751-8edc-8b549c27efcf"
    }
  ],
  "followUp": [
    {
      "goal": "在具备真实桌面浏览器与开发环境的阶段，执行清空重置状态事务在 replaceWith 成功后各类后续步骤抛错时的原子回滚测试，验证 DOM 树中已挂载新节点被彻底移除且无重复 ID 遗留。",
      "kind": "validation"
    }
  ],
  "groups": [],
  "questions": [],
  "summary": "本次独立分析通过登记 MCP 工具读取了原始输入材料 input:inp-01、fixture.png 真实像素映射及最新质量验收反馈 input:238e3436-8977-448a-8760-831f4163ca8c，并查证了规划期试验环境状态：\\n\\n1. 交付规范粒度校正发现：原 blk-tech-interface 将整段内部实现 JavaScript 冠以“完整自包含/无ReferenceError风险/契约基准”，造成规划阶段越权提供非权威内部实现，且伪代码在状态事务回滚判定与提交时机上产生了与正文不一致的隐性偏差。正式规范权威应保持为模块接口签名、状态所有权契约、前置守卫与成功提交/失败回滚的后置条件定义；内部 JavaScript 必须降级为“非执行示意，非CodingAgent直接复制的参考实现”，优先以状态机转换模型示意替代，确保规范严谨且不产生代码越权。\\n\\n2. R6-B1/P1 替换后回滚遗留双输入框缺陷发现：在 ResetController.handleReset 清空状态事务流转中，执行流程为：在内存预制新节点并复制持久属性 -> DebounceScheduler.cancel() 取消防抖任务 -> oldNode.replaceWith(newNode) 物理替换 DOM 节点 -> renderPlaceholder 复位展示区 -> clearInputError 清理错误 -> newNode.focus() 回焦 -> 原子提交更新 activeInputNode 与 inputGeneration。若在 replaceWith 成功后，随后的展示复位、错误清理或焦点恢复阶段抛错触发 rollback，原 rollback 逻辑使用 activeInputNode !== oldNode 判定新节点是否已挂入 DOM；但由于原子提交位于最后一步，此时 activeInputNode 仍指向 oldNode，导致条件判定为 false，进而走 insertBefore 分支仅回插原节点，未能从 DOM 树中清理已挂入的 newNode。独立合成复核表明该路径在 DOM 中遗留两个具有完全相同 ID（project-name-input）的输入框节点（newNode 的 value 为空，oldNode 的 value 为原草稿），引发 DOM 重复 ID 冲突与聚焦失准，破坏了“失败原子回滚且输入框保持可编辑”的核心契约。必须在 rollback 逻辑中确保彻底移除或替换已挂载的 newNode，恢复单一输入框的合法 DOM 拓扑。\\n\\n3. 受影响契约闭包：受影响的契约块包含 blk-tech-interface（接口规范降级与回滚签名）、blk-tech-error（E03 回滚节点清理语义）、blk-feat-reset（清空特性回滚承诺）、blk-flow-reset（两阶段事务流程回滚步骤）、blk-page-main-layout（页面 DOM 唯一性）、blk-acc-reset（用例 6 断言单节点与 0 重复 ID）、blk-deliv-task-reset-workflow（任务完成标准与清理验证）、blk-deliv-acc-full-e2e（端到端回滚场景验收断言）。\\n\\n4. 规划环境可用性查证：当前规划期环境中 Docker Desktop Linux 管道不可用，受控试验记录为 unexecuted，此限制属于当前规划工具宿主环境限制而非用户项目约束，真实浏览器和原生运行验证留待开发阶段在真实环境中执行。"
}
